{"bbox":[126.99855,37.57005,127.0005,37.5714],"clip":{"bbox":[126.998,37.5698,127.001,37.5716],"center":null,"radius_m":null},"count":6,"data_mode":"synthetic","features":[{"geometry":{"coordinates":[[[126.99855,37.57005],[126.99915,37.57005],[126.99915,37.57035],[126.99855,37.57035],[126.99855,37.57005]]],"type":"Polygon"},"id":"9999900100100010000","properties":{"area_m2_geom":1764.9,"area_missing_reason":null,"bbox":[126.99855,37.57005,126.99915,37.57035],"bon":1,"bu":0,"emd_code":"9999900100","emd_name":"가상동","jibun_mismatch":false,"jibun_raw":"1대","jimok":"대","label":"1","mountain":false,"pnu":"9999900100100010000"},"type":"Feature"},{"geometry":{"coordinates":[[[126.9989,37.5704],[126.9993,37.5704],[126.9993,37.5707],[126.9989,37.5707],[126.9989,37.5704]]],"type":"Polygon"},"id":"9999900100100010001","properties":{"area_m2_geom":1176.6,"area_missing_reason":null,"bbox":[126.9989,37.5704,126.9993,37.5707],"bon":1,"bu":1,"emd_code":"9999900100","emd_name":"가상동","jibun_mismatch":false,"jibun_raw":"1-1대","jimok":"대","label":"1-1","mountain":false,"pnu":"9999900100100010001"},"type":"Feature"},{"geometry":{"coordinates":[[[126.9994,37.5707],[126.9999,37.5707],[126.9999,37.571],[126.9994,37.571],[126.9994,37.5707]]],"type":"Polygon"},"id":"9999900100100020000","properties":{"area_m2_geom":1470.7,"area_missing_reason":null,"bbox":[126.9994,37.5707,126.9999,37.571],"bon":2,"bu":0,"emd_code":"9999900100","emd_name":"가상동","jibun_mismatch":false,"jibun_raw":"2대","jimok":"대","label":"2","mountain":false,"pnu":"9999900100100020000"},"type":"Feature"},{"geometry":{"coordinates":[[[127.0001,37.5711],[127.0005,37.5711],[127.0005,37.5714],[127.0001,37.5714],[127.0001,37.5711]]],"type":"Polygon"},"id":"9999900100100030000","properties":{"area_m2_geom":1176.6,"area_missing_reason":null,"bbox":[127.0001,37.5711,127.0005,37.5714],"bon":3,"bu":0,"emd_code":"9999900100","emd_name":"가상동","jibun_mismatch":false,"jibun_raw":"3대","jimok":"대","label":"3","mountain":false,"pnu":"9999900100100030000"},"type":"Feature"},{"geometry":{"coordinates":[[[126.9993,37.5703],[126.9997,37.5703],[126.9997,37.5706],[126.9993,37.5706],[126.9993,37.5703]],[[126.99935,37.57035],[126.99935,37.57045],[126.99945,37.57045],[126.99945,37.57035],[126.99935,37.57035]]],"type":"Polygon"},"id":"9999900100100040002","properties":{"area_m2_geom":1078.5,"area_missing_reason":null,"bbox":[126.9993,37.5703,126.9997,37.5706],"bon":4,"bu":2,"emd_code":"9999900100","emd_name":"가상동","jibun_mismatch":false,"jibun_raw":"4-2도","jimok":"도","label":"4-2","mountain":false,"pnu":"9999900100100040002"},"type":"Feature"},{"geometry":{"coordinates":[[[[127.0,37.5702],[127.00015,37.5702],[127.00015,37.5705],[127.0,37.5705],[127.0,37.5702]]],[[[127.00025,37.5702],[127.0004,37.5702],[127.0004,37.5705],[127.00025,37.5705],[127.00025,37.5702]]]],"type":"MultiPolygon"},"id":"9999900100200010002","properties":{"area_m2_geom":882.4,"area_missing_reason":null,"bbox":[127.0,37.5702,127.0004,37.5705],"bon":1,"bu":2,"emd_code":"9999900100","emd_name":"가상동","jibun_mismatch":false,"jibun_raw":"산1-2임","jimok":"임","label":"산1-2","mountain":true,"pnu":"9999900100200010002"},"type":"Feature"}],"generated_at":"2026-09-23T09:00:00Z","j5parcels":"1.0.0","source":{"crs":{"datum_shift":null,"detected_from":"prj","ellipsoid":"GRS80","epsg":5186,"name":"KGD2002 / Central Belt 2010"},"dbf_sha256":"626147c20716875e8163f3777ecff3782f2b2d3d06fc8903a302d10df9122e10","encoding":"cp949","fields":["PNU","JIBUN","BCHK","SGG_OID","COL_ADM_SE"],"file":"synthetic_parcels.shp","geometry_version":"2026-09-01","license":"가상자료 (이용허락 해당 없음)","name":"가상 연속지적도 (synthetic)","record_count":6,"shp_sha256":"96eb6e03f756481b2c33eee6b47b733be87102af4c9da33246792d2c9740ff22"},"type":"FeatureCollection","warnings":[]}
